Doctor Name,Negative_Reviews,Positive_Reviews,No_of_Negative_Reviews,No_of_Positive_Reviews,Specialty,Gender,No. of Reviews
Dr. Pranav Patel,,"Dr. Patel is a great doctor. My entire family (in laws, in laws in laws, children) go to him. He has helped us when others did not have answers. He has impacted our lives' greatly, for that we will be forever thankful! He is a great Dr he has worked with my family for years and has done wonders for all of us, thank you doctor. Chris I wish I did not go to Patel as long as I did. He is a very arrogant man. Yes he is pretty good at what he does but all he cares about is making money, not his patients. Notice how he's starting all this lipo crap up. ALL this man cares about is MONEY. He claims that he is not taking Blue Cross Blue Shields insurance anymore but the truth is that THEY don't want HIM anymore. He has been dishonest. He feels that they didn't give him enough money per visit. M O N E Y H U N G R Y. Please do not waste your time going to this man for your health. Find someone else. I am warning you.",,3,Internist / Geriatrician, Male,4
Dr. Raja Chatterji,,"I have been going to Dr. Chatterji for almost 20 years now and he has always taken the time to answer questions and make me feel comfortable. I would recommend him to everyone! I transfer to Dr. Chatterji at 16 weeks preg (orig Dr was no longer delivering babies). I was blessed to have such a compassionate doctor to be able work with. I have complicated pregnancies and he was very knowledgeable & took the time to discuss my issues. I never waited for my appointments, the office staff was amazing. I would recommend Dr. Chatterji to anyone needing an OB/GYN!",,2,Gynecologist (OBGYN), Male,2
Dr. Raman I. Popli,,"Dr Popli is the best, easy to reach, he is incredibly knowledgeable . I never feel rushed. He explains everything . He goes out of his way to help his patient . I strongly recommend him Dr Popli is the best primary care in Crystal Lake. I never felt rushed, he is genuinely concerned about his patients. He is kind , passionate, and caring. He is very thorough and happy to explain any concerns. I highly recommend him as outstanding family doctor Dr. Popli is very easy to talk , he listens, and you are never rushed, he is thorough, and he really cares about well being of his patients. I have been with him for over 10 years. Very thorough and approachable, great bed side manners The best treatment value , thorough check up, avoid wasting time with hospital doctors who will see you for 5 minutes after waiting for 2 hours in waiting room, then charge you ""facility fee"" for waiting 2 hours in their waiting room Dr Popli is great, his bed side manners are impeccable, he thoroughly explains the best course of action and gives you options , he is genuine and caring , simply the best doctor I have been Dr. Popli's patient for over 10 years, his bed side manners are outstanding, he takes time to listen, and never rush, I strongly recommend him Dr. Popli diagnosed my condition very aptly and in the first appointment. I am very happy with the service and would highly recommend it. Excellent professional service by the staff and appointments are easy to make as well. Dr Popli is very caring, knowledgable, and intelligent. He is five star doctor. I strongly recommend him as general family docotor.",,9,Internist / Geriatrician, Male,9
Dr. Randall N. Clark,,"Dr. Randall Clark was very professional yet down to earth and easy to talk to. He was extremely knowledgeable, was able to answer all my questions and seemed to really care. I would highly recommend this doctor. Dr Clark is a really nice caring doctor and I will stay with his practice for many years to come. He's okay. I had an unexpected hospital stay and never found out until I was home, why he never saw me during my 6 day stay. He said he has practiced long enough where he doesn't NEED to make hospital rounds; he hires a service to do it for him. If anyone anticipates a hospital stay, ask your doctor if he/she are considered the primary physican even if they aren't doing the surgery. This is important in regards as to who admits and releases you from the hospital. I will switch to another physican who is more caring and responsive to my needs. As a woman, I do not feel that comfortable talking to him. I prefer female doctors and will switch for that reason. Dr. Randall Clark was very professional yet down to earth and easy to talk to. He was extremely knowledgeable, was able to answer all my questions and seemed to really care. I would highly recommend this doctor. Dr Clark is a really nice caring doctor and I will stay with his practice for many years to come. He's okay. I had an unexpected hospital stay and never found out until I was home, why he never saw me during my 6 day stay. He said he has practiced long enough where he doesn't NEED to make hospital rounds; he hires a service to do it for him. If anyone anticipates a hospital stay, ask your doctor if he/she are considered the primary physican even if they aren't doing the surgery. This is important in regards as to who admits and releases you from the hospital. I will switch to another physican who is more caring and responsive to my needs. As a woman, I do not feel that comfortable talking to him. I prefer female doctors and will switch for that reason. Dr. Randall Clark was very professional yet down to earth and easy to talk to. He was extremely knowledgeable, was able to answer all my questions and seemed to really care. I would highly recommend this doctor. Dr Clark is a really nice caring doctor and I will stay with his practice for many years to come. He's okay. I had an unexpected hospital stay and never found out until I was home, why he never saw me during my 6 day stay. He said he has practiced long enough where he doesn't NEED to make hospital rounds; he hires a service to do it for him. If anyone anticipates a hospital stay, ask your doctor if he/she are considered the primary physican even if they aren't doing the surgery. This is important in regards as to who admits and releases you from the hospital. I will switch to another physican who is more caring and responsive to my needs. As a woman, I do not feel that comfortable talking to him. I prefer female doctors and will switch for that reason.",,9,Family Doctor / G.P., Male,3
Dr. Randy L. Calisoff,,"Very personable and helpful for treating my pain. Would highly recommend him. Excellent pain physician, really caring and does the best for my care. Excellent and compassionate physician A great listener. Takes the time to know you.",,3,Pain Management Specialist / Physical Therapist, Male,3
Dr. Ravi R. Iyer,"Dr.Ravi Iyer has a big mouth and tells your medical conditions to others. Very unprofessional. He can lose his license for big mouthing. If the medical board want to investigate then I would like to be a witness. I have visited him for regular check up and he charged as special visit and i ended up paying 900$. I have called staff and my insurance company but no help. Specially his staff was terrible. I will die but never visit this greedy doctor, he can do anything for money, totally unprofessional and rude. His staff is one of the worst medical staff i have ever seen in USA. Always rude and want to fight specially the front receptionist. Dr Ravi Iyer is knowledgable person but makes you more visits and all the time dealing this nasty staff is very painful. not going anymore. Normal charges are $65 but he charged $100. First visit he told me NO full physical first meeting, second visit he told me just give your urine and blood, when report will come, he will do the full physical next time. Why? I asked, his answer was if there is something wrong he will focus on that area. I mentioned why wait for something wrong to happen and its call FULL PHYSICAL why wud you focus on particular bad results. Well, i did go third time but just to pick up my report and all was well, thank god. He does nothing but ask u to come next time. Some other south indian family comes then he is all friendly and talking family and visits to India. Worthless visits. also he just tells me this is what is wrong with u go to the specialist. what is he there for I am not sure. I went to Dr. Iyer several times. He is rather rude and unknowledgeable. He examined me for less than two minutes. On my visits, he was very rough with the few ailments I should him. For my sprained ankle, he grabbed it, swung it around and them told me there was nothing wrong with it. It hurts to this day. In addition, any medical advice he gave me was useless. He told me my eardrum was very messed up when I showed him my tinnitus. Later he referred me to a specialist who said my eardrum looked perfectly normal. He also told me buying an electric toothbrush would stop my gums from bleeding. I bought the $100 toothbrush and nothing happened. He charges $280 per visit before insurance. His advice was useless and his demeanor was very rude. I went to him because it was close to my work, but his advice was useless and not worth the time/money. Dr.Ravi Iyer has a big mouth and tells your medical conditions to others. Very unprofessional. He can lose his license for big mouthing. If the medical board want to investigate then I would like to be a witness. I have visited him for regular check up and he charged as special visit and i ended up paying 900$. I have called staff and my insurance company but no help. Specially his staff was terrible. I will die but never visit this greedy doctor, he can do anything for money, totally unprofessional and rude. His staff is one of the worst medical staff i have ever seen in USA. Always rude and want to fight specially the front receptionist. Dr Ravi Iyer is knowledgable person but makes you more visits and all the time dealing this nasty staff is very painful. not going anymore. Normal charges are $65 but he charged $100. First visit he told me NO full physical first meeting, second visit he told me just give your urine and blood, when report will come, he will do the full physical next time. Why? I asked, his answer was if there is something wrong he will focus on that area. I mentioned why wait for something wrong to happen and its call FULL PHYSICAL why wud you focus on particular bad results. Well, i did go third time but just to pick up my report and all was well, thank god. He does nothing but ask u to come next time. Some other south indian family comes then he is all friendly and talking family and visits to India. Worthless visits. also he just tells me this is what is wrong with u go to the specialist. what is he there for I am not sure. I went to Dr. Iyer several times. He is rather rude and unknowledgeable. He examined me for less than two minutes. On my visits, he was very rough with the few ailments I should him. For my sprained ankle, he grabbed it, swung it around and them told me there was nothing wrong with it. It hurts to this day. In addition, any medical advice he gave me was useless. He told me my eardrum was very messed up when I showed him my tinnitus. Later he referred me to a specialist who said my eardrum looked perfectly normal. He also told me buying an electric toothbrush would stop my gums from bleeding. I bought the $100 toothbrush and nothing happened. He charges $280 per visit before insurance. His advice was useless and his demeanor was very rude. I went to him because it was close to my work, but his advice was useless and not worth the time/money.","Double books patients and rushes to see the next patient. He hardly listens to you. Good doctor turned greedy with no time for patients. There are so many better options out there. Avoid at all cost. I agree with others... Very rude and acts like he is smart, but doesn't spend time with patients... You can clearly see him browsing Facebook when he is actually with a patient... Very unprofessional... Save yourself some time and energy - find a better doctor... Dr Iyer - is very helpful , kind and great Doctor who cares for the patient first. I would highly recommend this Doctor. He is very knowledgable to cure patients really quick I found this doctor extremely helpful. Not only did he treat me for my illness he actually fast-tracked my appointment with the specialist. In addition he as well as his staff respond to email and will offer same day appointments as far as possible. Double books patients and rushes to see the next patient. He hardly listens to you. Good doctor turned greedy with no time for patients. There are so many better options out there. Avoid at all cost. I agree with others... Very rude and acts like he is smart, but doesn't spend time with patients... You can clearly see him browsing Facebook when he is actually with a patient... Very unprofessional... Save yourself some time and energy - find a better doctor... Dr Iyer - is very helpful , kind and great Doctor who cares for the patient first. I would highly recommend this Doctor. He is very knowledgable to cure patients really quick I found this doctor extremely helpful. Not only did he treat me for my illness he actually fast-tracked my appointment with the specialist. In addition he as well as his staff respond to email and will offer same day appointments as far as possible.",10,8,Family Doctor / G.P., Male,9
Dr. Renata J. Variakojis,"Good Dr until she just disappeared April of 2017. No warning, no notice, just completely abandoned her suffering chronic pain patients. Leaving senior citizens whom she hooked on narcotics scrambling to find other doctors, going to ER's or simply going through withdrawl. 

The creed of ""Do no harm"" not in her vocabulary. There should be criminal punishment for such behavior! Very knowledgeable, highly-trained and empathetic pain specialist. Helped me immensely with my carpal tunnel syndrome. Don't be dissuaded by slightly longer wait times--great doctors have a lot of patients wanting to see them. I also don't understand gripes about controlled substances--there are strict rules that doctors have to follow about such medications. With all the headaches (pun intended) physicians have to face these days due to insurance issues, Obamacare, etc., it is certainly not ""all about making money"". Physicians have to work twice as hard to make a fraction of what they used to. I am in a medical field, I know how difficult it has become for many doctors. They wait for visits was terrible. I wasn't on any controlled substances, but she wouldn't refill my prescription if I was late seeing her. It's all about making money. She was trying to push me into doing treatments I didn't want to do. Her staff was downright rude. They also REFUSED to submit paperwork to the online pharmacy to get a special pain cream covered for me. Pretty much it wasn't even a slightly good experience working with her and her office. When saw Dr. V, I was in severe constant chronic pain from post concussion syndrome, neck and upper spinal problems for 33 years. Plus lupus, fibro and R.A. V gave worst initial visit ever from a ""pain specialist."" Barely looked at forms and reports from drs, asked few questions, and insisted I try meds I had tried several times. I never said a word even tho meds were listed as taken, and reactions: all terrible. Usual wait was 2- 4 hours. I decided to see what she could do. Three more times she gave me meds I had already tried 2 or 3 times each for 4 months. Two of those times I had severe serotonin syndrome reactions ever though I warned her about having it previously. Getting meds a nightmare. If saw her on exact day meds due, she wrote your script. Otherwise, had to call nurse and ask her to mail them.If scripts not arrive, nurse screamed at me for not reminding her. If I called to remind, nurse screamed because she sent them out. After 19 visits, quit, just horror show","Dr V. has treated me for a very serious spinal condition with the resulting unrelenting pain for 5 years. She has exhibited extensive knowledge , as well as, an unending empathy for my condition. Her staff are thoughtful, helpful and efficient as well as cheerful. Over 30 to 40 visits I have waited more than 45 minutes once or twice. Dr V. and her staff are a valued partner/addition in the health care environment of Palos Heights Il.

Highest recommendation possible. Dr. V. has treated the pain in my neck and shoulders. She spends a lot of time with her patients and the results are amazing. Her treatments have worked wonders. I highly recommend her. Excellent caring physician, was extremely helpful with my chronic pain, would recommend highly Dr V truly cares about my condition and spends as much time as necessary to understand my concerns. She is the most understanding doctor that I have seen in the last three years and would not change for anything. My waits are short and the staff is friendly. I'd recommend this is a well-rounded office and a fantastic doctor!",4,4,Pain Management Specialist / Physical Therapist, Female,8
Dr. Reno K. Ahuja,"Very bad experience. Waste of time and money. Was of no help Don't do it! I was sent to Dr. Ahuja for an ADD evaluation. I was only needing a letter for college so I could utilize special study options like audio textbooks,and un-timed testing and different methods of learning and comprehending. I verified THREE different times with her receptionist that this Dr. was who I needed to see. Only to go and her say she could not diagnose me or give me the letter for school. However she could give me this MEDICATION for add and I could come back ever 30 days for a appointment and refill. My question is how can you give me such powerful drugs for a problem you wont diagnose. The medication made me feel like I was shooting espresso.She does not want me using the services at school because I wouldnt need to come in every 30 days for a refill of this poison she is pedaling. She spent the rest of the appt trying to convince me I was depressed and I needed to be medicated for that also. Total bunk! There are other options for people with learning problems.","Dr. Ahuja is very professional and has been flexible in treating my illness. Although I am hesitant about change(my OCD) I believe that she is trying to work with me on managing my symptoms. Her staff is nice and usually attentive, and her nurses are pretty thorough. Dr. Ahuja is also working with my psychologist to find out the best way to approach treatment, both cognitively and medically. I randomly picked Dr Ahuja from a list given to me by my weight loss surgeon for a psych evaluation (required for surgery). Well, boy did I make a mistake. Yes, I love food, or I would not be in this situation in the first place, that's a no-brainer. I am already going to support meetings thru my weight loss clinic & have lots of family support. Dr Ahuja wouldn't clear me for surgery until I see a counselor who will take me grocery shopping to pick out healthy food & attend support meetings. LOL! I'm fat, not stupid. Now my surgery will be set back by a few months. I wasn't depressed before, but Dr. Ahuja has done her best to drag me down. Oh and she has a large blackhead on her nose that needs to be popped, not to mention I question the opinion of anyone who wears olive and orange printed pants with a bright red blazer. I love Dr. Ahuja. She lays out the options and guides treatment without forcing anything. We met after my previous doctor retired. In Southern Illinois, I've had many unfitting experiences with general practitioners and specialists. Dr. Ahuja isn't afraid to choose science over politics, and I trust that she cares about my quality of life. I look forward to our meetings. While our relationship is entirely professional, I must say she is not only brilliant, but is quite ravishing too. Hope I don't sound biased--it's just really hard to think of anything critical; we've never had any disagreements. Being diplomatic, honest, and focusing on treatment instead of denial has served me well with her. I hope she stays in the Energy area for a long time. :)",2,3,Psychiatrist, Female,5
Dr. Rian J. Rowles,"I am appalled that this Dr. does not care for his patients enough to return call and even respond to letters informing him of our son's crisis. Our son is mentally ill so projects that he is just fine when in reality he is in profound distress and pain. This Dr should be turning to his family members to get the correct picture. Our son is addicted to Adderall prescribed by this Dr. and over the year has manifested a complete change of personality. He has become paranoid, suspicious, angry and combative with moods spiking and falling throughout the day. Naturally, we witness this when he is not in the presence of his DR., who proclaims he is A-OK after a mere 10 minute visit. Dr. Rowles is a drug dealer and never return calls! He is unethical and a terrible doctor! This dr is terrible all his does is prescribe medication without seeing his patient . As far as I'm concerned he is just a legal drug pusher !! Terrible very unethical !!! Does not call back even when message is left. Nice guy but the wait is terrible I absolutely do not recommend if you need anything more than an occasional office visit. Totally unresponsive to calls, pages and all requests for assistance. On one occasion, it took more than two months to finally get a callback while a family member was undergoing treatment. More recently, an appointment was cancelled without explanation and even as a current patient, the next availability was two months in the future. While that was an issue which I appealed with office staff to no avail, after almost four weeks of multiple calls and messages to the doctor for assistance I have yet to receive a response. As a practitioner whose occupation involves treating patients in crisis and/or taking prescribed medication which requires monitoring, this is inexcusable. He seems genuine and caring while in your presence, but is totally inaccessible once you leave his office. Dr never calls patients back! 1st visit had to wait 45 minutes i would not use this facility again..... This man has been saving my life for over 2 years now. He listens, spends all the time I need with me, is exceptionally knowledgable about meds and PTSD, anxiety and depression. Excellent bedside manner. Young so he'll be around for my whole life! Could not survive without his help and expertise.","dr. rowles is nice and caring. his office is great and they have many good resources. Great Psychiatrist. Kind, flexible, sincere. Highest recommendations.",7,2,Psychiatrist, Male,9
