Doctor Name,Negative_Reviews,Positive_Reviews,No_of_Negative_Reviews,No_of_Positive_Reviews,Specialty,Gender,No. of Reviews
Dr. ABDULMASSIH Abdulmassih,,"Dr. Abdulmasshi is the best doctor out there. Amazed. I have been going to Dr Abdulmassih for years ever since his partner passed away and I inherited him as my internist. He knows what he is doing, is polite, friendly, and most importantly has been 100% correct every time I have had a health issue and I have some chronic issues that require management. The only problem some may here there is that his offices are very busy. You should be prepared to wait a some extra time for your appointment which I am ok with to get Dr Adbul. DOCTOR ABDULMASSIH IS THE BEST DOCTOR IN THE WORLD!!!!!!!!!!!!",,3,Family Doctor / G.P., Male,3
Dr. Ahmad A. Shaher,,"Dr shaher is an awesome human being and a doctor. He is good teacher and patient doctor. I have learnt so much from him. He truly addresses every complaint a patient has and strives to provide the best treatment. I would recommend him for students getting medical training or anyone looking for a good family doctor. Dr. Shaher is the most understanding, smart and compasionate doctor.",,2,Family Doctor / G.P., Male,2
Dr. Alan L. Sisson,I am not sure how how doctor stays in business. With manners like his he should be a truck driver. No offense to the truckers.,,1,,Emergency Room Doctor, Male,1
Dr. Ali Kafi,Stay away from this doctor (and the term is used loosely. He performed a surgery on my dear mother and he did the incorrect surgery. Her life was miserable until her death. Does not answer questions and is arrogant. Stay away from this doctor (and the term is used loosely. He performed a surgery on my dear mother and he did the incorrect surgery. Her life was miserable until her death. Does not answer questions and is arrogant.,,2,,Cardiothoracic Surgeon, Male,1
Dr. Allan L. Tompkins,,Dr. Tompkins is a great surgeon. He replaced my knee and I have had no pain or problems since then. I trust him fully. I tell everyone I know about him. Dr Tompkins has been our orthopedic surgeon for the past 15 years. He has provided wonderful service to me and other members of my family. I would not hesitate to recommend Dr. Tompkins to anyone needing orthopedic services. Dr. Tompkins is a great surgeon. He replaced my knee and I have had no pain or problems since then. I trust him fully. I tell everyone I know about him. Dr Tompkins has been our orthopedic surgeon for the past 15 years. He has provided wonderful service to me and other members of my family. I would not hesitate to recommend Dr. Tompkins to anyone needing orthopedic services.,,4,Orthopedic Surgeon, Male,3
Dr. Allen David Bloom,"Doctor left me deformed from a surgical procedure and now I have to pay another doctor to fix it This doctor SUCKS; stay away from him. Switched from in-network to out of network during my treatment and no one told me. Now I have these huge bills to pay. Performed surgery on me that is going to require plastic surgery to fix.... Please seek out another general surgeon AWFUL, do not use this man! He doesn't listen to you or your problems, he rushes your office visits, he's flighty in behavior and conversation, he suggests additional surgery even before he knows what the problem may be, he takes awful notes on the surgery he performs, and he doesn't give helpful post-surgical info. My neighbor's friend had very similar issues with this doctor for his surgery, and had I known about his experiences before I had my surgery, I would have changed doctors. I have an HMO not listed, and basically not a lot of choices in surgeons, but I had thyroid cancer and had to have my thyroid taken out. I am still recovering from a surgery that according to the webmd is pretty big procedure requiring special monitoring. My surgery took 35 minutes the first time, but later the same day I went back in surgery for uncontrolled bleeding and swelling. I still am waiting to see if my voice will return, another complication of surgery that I may have temporarily lost my voice, although it has been almost 6 months. My advice always go for a 2nd opinion, even with bad insurnace you are entitled to a second opinion and make sure it is not a doc from the same practice. The absolute WORST doctor. Please, do NOT use him. My father recently saw him for a tumor, and he immediately threw out the word 'cancer' even before a biopsy has been done. He then proceeded to tell us that my father needed a chemo port put in ASAP...again WIHOUT a confirmed diagnosis! Oh, and it's not cancerous. He was so insensitive, told my mother basically to stop crying. Terrible, terrible, terrible! This man should have his license revoked. This doctor completed an emergency appendectomy on my 11/6/2000. As I lay in the ER, He happened to walk past and was called to my room. He examined me and had more test done to diagnose my problem correctly. While in surgery, he discovered another problem but choose to not do the surgery on this unknown problem but did tell me about it upon my recovery. When I visited him in his office after surgery, he again asked if I had followed up on the problem that he discovered while on the table and proceeded to call my own doctor on the spot to ensure that I/the problem was taken care of. I found him to be very caring. However, that was 7 years ago! I beg you to NOT visit this physician. I felt like I was treated TERRIBLY by this doctor. I was left with numerous problems from the surgery this doctor performed on me. Also, he did not tell me all of the associated risks of the surgery that he performed on me. He also did not give me adequate pre-operative instructions for my surgery so I was left completely impacted after surgery. Ridding myself of the impaction caused additional PERMANENT damage to my own body. He is an UNCARING physician. He does not know how to offer any other medical advice other than to CUT. DO NOT visit this physician. In my opinion, he is the definition of BAD doctor.",The doctor just took out my thyroid. I guess he did a good job and various medical staff say he's a good surgeon. He rushes all the time. He didn't tell me any of the pro's or con's of surgery. He didn't tell me side effects of the medicine or what I may feel like after surgery. He was an hour late for the surgery. The nurses had a hard time getting in touch with him to discuss my very low calcium symptoms with him and get me medicine. I had a very hard time getting in touch with him when my symptoms become much worse at home. He never came to see me in the hospital after surgery. And I got a bill from his associate for 'helping' in the surgery. I never met him and not one person in the hospital mentioned he had a helper. No other doctor was waiting for him when he was running so late. My opinion - look into other surgeons. Dr. Bloom is a terrible physician/surgeon. He did not give me quality care. He seemed only interested in getting me in to surgery without giving me the proper pros and cons of the surgery. His bottom line is more important to him than truly listening and caring about his patients. Do NOT visit this doctor. There are many more caring physicians out there that are more worth your time.,7,2,General Surgeon, Male,9
Dr. Alyce F. Jackson,,"Dr Jackson is the MOST caring Doctor I have met!She has a wonderful bedside manor,a very professional approach to us,her patients,while maintaining a 'friend' type relationship!Dr Jackson listens,you can see the sincerity in her eyes when you are having your appointment with her. Dr Jackson has a great work ethic,and tries everything possible to offer you complete health care and rehab,she has been a blessing in my life since I became her patient.I have regained alot of movement and life while under her care! The staff can make you feel a bit 'on the spot' or like you have done something wrong,but this should not reflect,in the least bit,on Dr Jackson. I have named this Doctor, my Angel on earth,she has never let me down,nor ignored any concerns that have arisen.if you have been stuck by a trauma of any kind,and need help getting back on your feet,regaining your quality of life, Dr Jackson is by far,the best doctor to go to,as she will help you in every way possible!",,1,Pain Management Specialist / Physical Therapist, Female,1
Dr. Anas Alzoobi,iI have found this doctor to be very helpfull and he listen you your every needs.,,1,,Anesthesiologist, Male,2
Dr. Andrew S. Rudin,"Just another one of the dope pushers.

https://www.syracuse.com/news/2019/05/syracuse-doc-banned-from-prescribing-painkillers-after-arrest-at-st-joes.html Nothing but a piece of trash, opiate pushing, drug dealer who's under indictment, fired by St. Joe's and is under investigation by the State of NY Health Department. Andrew Rudin lost a $1.6M malpractice lawsuit where he caused a stroke and permanently injured a patient. Here is the link to the court document that explains it all:

https://www.gpo.gov/fdsys/pkg/USCOURTS-tnwd-1_11-cv-01103/pdf/USCOURTS-tnwd-1_11-cv-01103-0.pdf Cured my arrhythmia in 2 hours after suffering with the condition for 20 years. I owe him my life.","Love the most recent positive review (dated 4/18/19) that was submitted 11 days after Rudin was arrested by the DEA and indicted. Too funny! Excellent Physician!! Cares deeply for his patients and their families. Andrew Rudin is the supervising physician for this NP in Tennessee.

https://www.tennessean.com/story/money/industries/health-care/2018/11/13/tennessee-nurse-overprescribe-opioids-jeffrey-young-rock-doc-dea-raid/1926865002/ Andrew Rudin lost his hospital privileges in Tennessee. You can see this on his Tennessee license lookup on his practitioner profile. His Tennessee license number is 45038.

Here is that link

https://apps.health.tn.gov/Licensure/default.aspx Best cardiologist in America. He saved my mom’s life. I have endless gratitude and respect for Dr. Rudin. Any hospital would be lucky to have him on staff. Dr. Rudin is one of the most knowledgeable doctors. He is very caring and explains everything where we the patient can understand. Dr Rudin truly cares for his patients and it shows with his work ethic, and his knowledge of the heart is unparalleled. Dr Rudin always puts the patient first. We are fortunate to have him as our doctor. Wonderful experience. Extremely knowledgable. I highly recommend Dr. Rudin to family and friends who need a Cardiologist. He is a fantastic, caring, knowledgeable physician. Absolutey would refer family and friends to Dr. Rudin..Great Doctor Fantastic Doctor. He was polite, caring and cured my abnormal heart rhythm in 2 hours. I had been suffering for almost 10 years! Highest recommendation. Very pleasurable experience, thoughtful very knowledgeable dr.rudin is the best! he is super smart and really good at what he does!! thank god for dr.rudin",4,14,Cardiologist, Male,18
