Doctor Name,Negative_Reviews,Positive_Reviews,No_of_Negative_Reviews,No_of_Positive_Reviews,Specialty,Gender,No. of Reviews
Dr. John H. Giroux,Not practicing in Chicago area anymore - if you are looking for your medical records they are housed with Dr Aurora in Orland Park. Phone # 815-717-8960.,"This doctor kept telling me my son had tonsillitis when in fact he had a double ear infection. This happened numerous times. I would take him one day (not easy to get an appointment for a sick kid you wait until a nurse calls and decides if you can have an appointment and you might wait all day for that call). Then I would have to take him back the next day and low and behold he had a double ear infection. After this happened several times in a matter of two months we went running from that office and found a much better doctor who knew what an ear infection looked like before it ballooned into 2 ear infections. He wasn't very willing to give up my kid's medical records either. The wait time is awful. Once I could hear him talking on the phone outside the door that was very obviously a personal call. He has no respect for other people's time. Oh and if you have a baby with reflux forget getting any help. This same son projectile vomitted at 2 weeks old and he did nothing to help him. Dr. Giroux is amazing! He was my doctor was i was younger, and is now my sons doctor. He still remember all my symptoms from me growing up. He will definetly put your child to ease with his kindness. The only down side to this office is the waiting time. I always show 30-45 minutes before my appt. time just to get out in time. I would definetly recomend this doctor! :) He has always been very friendly and approachable, BUT the wait time is horrible. I constantly schedule the first appointment of the day and have on numerous occasion had to wait over 40 minutes because others have walked in a few minutes before my appt., without one and they saw them ahead of us. I have addressed this with the office staff and nothing seems to be done. I will continue to use Dr. John because my children are at ease with him and he apears to be very good with kids and enjoys his job, especially since the waiting room is always busy. But he needs to address the issue if you make an appt. all appt come first and walk-in wait till the end of the day, hence the meaning APPOINTMENT. He was my pediatrician for many years and was excellent. He knows how to put kids at ease. He even still remembers me and my quirks despite not having been my physician once I went off to college. I definitely recommend him. Dr.John is the best doctor my kids ever had.... They love him.Keep up the good work doc. Dr. John was the first doctor that really listened to us, and didn't discount what we had to say! He helped us to overcome our daughter's BM problems, after years of asking for help! We LOVE him! He does a great job with my child who has special needs. He lets the kids call him Doctor John, which tells you that he does not have a cocky attitude. Dr. John is terrific with children. He has always diagnosed my children accurately.",1,8,Pediatrician, Male,9
Dr. John L. Lehtinen,"Very nice,understanding;-)happy to have him in my corner;-) Very nice,understanding;-)happy to have him in my corner;-)",,2,,Family Doctor / G.P., Male,1
Dr. Jonathan C. Gamze,"Dr. Gamze is not just an amazing doctor, he is also an amazing person. I started seeing him years ( I mean 14 years perhaps?) No one could diagnose me. He listened and also to those that think he OVER PRESCRIBES he is the doctor that actually reffered me to another one to have thorough testing done. ( and I mean weeks worth of testing to see if I had ADHD. ) I assumed at that time it was the law, he cared enough about me and his patients he never just prescribed stimulents until HE KNEW i was in fact tested and ( in a controlled and non controlled). ( the testing that you cannot trick doctors.) for true ADHD patients. NOT one time did he overprescribe me. In fact he saved me, my mind raced I had so much anxiety. School was so difficult, Its like a million things at one time in my head. And HE figured it out. ( do you people have any idea how MANY other doctors literally drugged me! Ambian, xanax, paxil. Ect. Ativan. Not ONCE did dr. Gamze do that at all. He treated my diagnoses. And ( for those people who think that he is a over prescriber or whatever:

TRY being a psychiatrist!! The truth is the mind is very complex! NO one knows truly. People coupd take A

Medication and have the adverse reaction. ESP when it comes

To dealing with dr gamze who specializes in ADHD. MEDICAID pays for it 3 days early! So NO i cannot begin to tell you how many friends i lost after they were drugged

With antidepressents ect. ( they killed themselves) to much seratonin) SO NO NARCOTICS is not whats killing people! Its the drugs that fly under the radar!! And PHARMACISTS are NOT DOCTORS! All this because of some dumb ass pharmacist! Props! you tried to tarnish his good name: however:

YOU WILL NEVER BRING HIM DOWN! He is above that. And has an amazing family. And is an amaZing persom who had to be put through HELL due to these allegations .. why him?! If YOUR kid is taking medications: - MANAGE THEM! 

Love Dr GAMZE

-. S LEONE I am concerned that Dr. Gamze maybe have overprescribed psychiatric drugs to my friends and family, and concerned that he has been disciplined by the State of Illinois Dept of Professional Regulation September of 2015...his licenses being suspended. www.idfpr.com Johnathan Gamze, is an extremely charming, highly educated, knowledgable & experienced Chief of medical doctors whom is also, a hell of a Snappy dresser! His dinner jacket, which appeared to be something he'd borrowed from a 1976 Burt Reynolds movie~a complete ensemble with a poofy, brown afgan was spectacular. & he not only, continuously engaged my every question, with astute expertise?? HE LISTENED TO WHAT I HAD TO SAY, COMPASSIONATELY & responsively!& mademoiselle, you might think about bringing your infant to a PSYCHIATRIST: beforehand, rather than coming on here to criticise a man whose job it is to enlist somatic therapies(pills), as being dense.... Why did you take a 3 year old toddler to an abnormal psychiatrist, in the first place?; jesus jones. I took my son there for a few appointments before I realized that ""Dr."" Gamze was worthless. My son had repeatedly been diagnosed as ADHD, ADD, depressed, and anxious and various medicines had been tried. After a few visits, Gamze said, ""He doesn't even look depressed to me."" My son and I got up and walked out. Someone please tell me what ""depressed"" looks like! Apparently, Gamze knows. I have had lifelong chronic depression, yet very few people in public would have ever known. I could usually mask it pretty well. Even depressed people know how to put on a good face.","Dr. Gamze is very compassionate. He honestly does care about his patients. He has returned any messages that I have ever left for him. As for over dosing- No way. You are always started on the lowest dose of a medication and only gradually allowed to up any medication. Who knows the patient better - the doctor who went to medical school and has actually evaluated and seen the patient and has years of experience with treating mental illness or a pharmacist who knows nothing about the patient or the patient’s life and probably has never even seen or spoken to the patient except the occasional hi and do you have any questions?

Dr Gamze will also work with your therapist if you give him your permission to speak to them. What some people might not understand is that psychiatrists are specialists in prescribing psychiatric medications. They went through all the additional schooling so of course it’s going to cost more than seeing a regular therapist. Anytime you go to any specialist it does! Dr Gamze has helped me for 20 years now. He is the most polite , non threatening person I have ever met. Years later my daughter also ended up going to him for ADHD and before any treatment or diagnosis she was sent to a neurologist for extensive testing.

My daughter is very shy and she even feels comfortable talking to Dr Gamze. I am grateful that a friend recommended Dr. Gamze to me. He is not only professional and knowledgeable, but truly a kind human being. He is always available to me and answers any voicemails that I leave for him. My personal experience continues to be very positive. HELLO people! Lol dr gamze wasbt suspended in 1989!! So RELAX PEOPlE Dr. GAMZE is an amazing doctor, he doesnt over prescribe!! He is the rare doctor that you come across that listens thst actually helps you( for those who have said he OVRF prescribed - let me clear for you? It seems these anyone wants to point a finger! However maybe T was you who couldn't ja dle the medication or you lied to him jusr to get the drugs ? In my 31 years and hes o am a doctor most people tHat say he over prescribes medication, maybe it's lol.thwt fact that he I the what again? The specialist the PSYCHIatRist!! You are not nor I am, and I have sent him for 13 years he never ever once over prescribes me he was godsenthe actually helped me so much, I owe him everything ( I do have adhd and anxiety but however I don seee him over prescribing plus - wbkemcr you are , did you it filled? I bet you did 

Don't blame gold ewtd person , doctor because yiur an addict and welcome. to word! Lol ( all doctors over presceibe they do what they think will help if he did he felt that you do j fact need the medication ? Maybe it wyou. Don't disrespect dr gamze becuew most mentally ill patients always thought k ther over dosed! BUT yoir an adult! Tell HIMz not the world you look sad. Dr Jonathan Gamze was an amazing doctor who cared. Has successfully helped me with anxiety and depression.. Very caring doctor who will go above and beyond to help you. Always returns my phone calls and very knowledgeable. One of the best doctors I have ever met. We had an overall excellent experience with Dr. Gamze. He is kind and attentive, and was able to help us with our middle-schooler who suffers from OCD and Tourette's. We were also told we would have a full hour session for $300 by the receptionist and that was not the case. It was 45 minutes at most and we felt as though we were rushed out. He knew his stuff, though, and did not push meds. The nicest, kindest and most understanding doctor ever. I went to him after having a heroin overdose. So I needed help and he prescribed me the medicine that helped me get a new job, make my me not crave illegal drugs, and feel more comfortable and confident as a person. I recommend this doctor to everybody. He helped me with controlling addiction, adhd, and probably saved my life. He will also not judge you when you ask about a certain medication. He does not treat you like an addict, he treats you like a person. $125 = amt for 15min. Meds update. Takes no insurance. Pay at time of service. I Submit for reimbursement. Good listener. Sincerely interested in me holistically. Very knowledgeable and extremely caring, listens to every detail and is wonderful with my middle school son. Terrible Experience! When I called their office, the nurse assured me of three things: 1.Gamze was an expert at treating trichotillomania (hair pulling) in young children and had treated numerous cases. 2. That he was not a doctor quick to prescribe drugs. 3. That we would have a full evaluation and one hour session with him during the first appointment. Upon meeting with him, we come to find out: 1. By his own words, he is not an expert in trich with children and only treated a couple of cases. 2. He wanted to immediately prescribe anti-depressants to my 3 year old. 3. The session was less than 45 minutes and he would not give me a straight answer when I asked him questions. We were able to get rid of the condition very easily by reading a couple of books and using a behavior redirection and it has never been a problem again! Following Dr. Jonathan Gamze, we would have put our baby on mind altering medication and continued to pay him for additional visits! Check out other docs first! BEST psychiatrist ever. EXTREMELY friendly and positive! Longest I've ever waited at an appointment is 20 minutes (VERY good for a pstchiatrist). DR Gamze is a very kind man. I have used his medical advise and support for over 10 yrs, for me and my family.. Love those 7:30 am appts before I go into work.. Also always has run on time.. no wait.. amazing kind man Dr. Gamze is the most friendly, patient and understanding doctor. He is so helpful and wants to help you feel 100% better Dr. Gamze is a wonderful doctor he really knows what he is talking about and listens to what you have to say to best help you find the right Rx and dosage my mom saw him for years which is how I found out how good he was I would recommend Dr. Gamze to anyone I am glad to see a website like this so the word can be spread about good and bad doctors Best doctor ever. Extremely nice, very knowledgeable, very caring man. If you need a psychiatrist he is probably among the best. I HAVE ALWAYS EXPERIENCED HIM AS VERY KIND, HELPFUL, AND UNDERSTANDING. I WOULD RECOMMEND HIM TO EVERYONE BECAUSE I AM A THERAPIST MYSELF AND I KNOW A GOOD ONE WHEN I FIND HIM OR HER. First of all, Dr. Gamze's staff is always as helpful as they can be. He was the first psychiatrist that i have ever been to, he was recommended by my therapist. When i had my first appointment with him, he was the nicest man I had ever met and has been ever since I have been one of his patients. He has been a great help for me to get better in my mental illness. About 7 months after I first saw him, I decided to get another opinion on what Dr. Gamze diagnosed me with. After meeting with the other psychiatrist I realized what an excellent doctor he was. He will help his patients anyway he can and he always makes me feel the confidence that I will be mentally stable. He is honestly the nicest man I have ever met. Not only that, he really knows what he is talking about. He asks many questions to make sure what he is prescribing you is what you need. I am a teenage patient and he prescribes me medication that I will not need to spend my entire life depending on. I 100% recommend him. Dr.Gamze was extremely respectful of our concerns and asked lots of questions. He worked in conjunction with our daughters professional counselor. That was extremely helpful in discerning the correct medication to prescribe. Dr.Gamze is very prompt in returning voice messages during the week. He is extremely polite and insists that we call him if we have any concerns at all about our daughters progress and treatment. We have worked with two other psychiatrists. Dr.Gamze is by far the most compassionate and knowledgeable. Best doctor ever, he was so great!!! He knew exactly what I needed to feel better, I can't thank him enough. So nice and caring. He is the BEST! Don't waste your time on any other psychiatrist. He works with two of my sons and on me. He believes in low doses of medicine and is extremely competent. If you are looking for personal service, you may want to go elsewhere. The doctor's phone is answered by a lengthy message, not a human being. He takes his time in evaluation (which is fine if your insurance company is paying). Really knows what he's doing. Really conservative with medicine. He won't give you something without making sure it's right for you first and telling you about it. Very friendly. Like the person who commented before me, I agree that Dr. Gamze cuts to the chase and he really knows his stuff when it comes to diagnosing a problem and prescribing medication - which is exactly what a psychiatrist should be skilled at. I personally would go to someone else if I needed therapy of any kind. I only see him for medication management now, but he always seems interested to know how my life is going and he has been really friendly and happy at every visit. I don't feel like he just prescribes me stuff and I'm out, there is a lot of conversation about how I feel on the medicine and whether or not I would like to continue with it. He has always called me back promptly when I left him messages and he always encourages me to call if I'm having any side effects with a medication. I like him... don't know what happened with the others who had bad experiences. Dr. Gamze is top notch! Anyone who says otherwise doesn't really know him. He doesn't accept insurance anymore but you can file a claim and get reimbursed later and it's worth every penny! I came to him after 15 years of mis-managed depression. I was at my lowest EVER and he helped save my life. It's been five years and I'm only on one low dose med and I'm doing great. He doesn't specialize in therapy but knows who to refer you to if you want a therapist. He is extremely talented in diagnosing and prescribing and he won't ""over"" diagnose you. If you are looking for a doctor who will cut to the chase, get you the meds you need and not put you through long talks that result in inaccurate diagnoses......go to Dr. Gamze. He won't put you on anything unless you need it. If you want a therapist get a therapist. If you want a highly trained medical doctor who knows psychiatry like the back of his hand....go to Dr. Gamze. I'm a nurse and I trust him with my life. He's the best there is!",4,25,Psychiatrist, Male,32
Dr. Kamal Patel,"This doctor was nasty to his nurse., He was unhappy when I consulted with a female MD regarding a women's issue. He told me on every visit afterward ""you had to see a women doctor"". He bothered me about how many children I should have. He does not seem to realize that women in this country have equal rights to choose what is best for them. When I left his practice to visit another MD I was informed that he gossiped. He has no manners or class.",,1,,Internist / Geriatrician, Male,1
Dr. Karen E. Taylor,,I have been going to Dr. Taylor for years and I love seeing her because she is a very smart black woman who is here to help the community. I have always felt comfortable asking her questions and have always left her office feeling satisfied that I know what is going on with my health. She is a wonderful doctor and an even better role model for young women.,,1,Family Doctor / G.P., Female,1
Dr. Kazem Hak,"Used to be my favorite doctor and was so sad to leave when insurance changed. However got excited when I could return when received new insurance. However it seems his disposition has changed doesn’t seem as caring or concerned when before he would’ve been. I am thinking it’s because I my hadn’t been more than a year since we change so we were grandfathered in with the current insurance. It almost feels as if were treated more poorly because of our insurance. Things that should be tested like my potassium which is always low, isn’t. Iron levels, isn’t. I am scared to ask questions anymore because he makes you feel dumb. This doctor I highly respected with my health before now I feel I’m being fluffed off and I rarely go unless u absolutely need to. Because of this experience I’m afraid to go to any doctor now. I left this office the last time and literally cried the whole way home because I felt Like I was being treated like a woman I was just worthless! As if I didn’t know my own body. I left there were no diagnosis end up in the clinic the following day to find out I have strep throat, A kidney infection and other stuff. No testing was done when I went even with my complaints. I used to be very impressed and thought he cared about my health and well being. He has changed in the last couple years and I have caught his staff in more than one fib. He quit taking my medicaid and let me know thru a letter after I got home from an appointment the same day. No notice, just wham and I'm out! He actually took my insurance several years ago when I lost a job and was going thru a tough time. I don't know what happened but he really changed in his attitude towards me. I used to put him on a pedestal because I thought he cared so much for my health and well being. I don't know what happened. I actually am extremely saddened that he chose to not accept my insurance any longer and I have to leave his practice. Dr Hak is an awesome Internist who is knowledgeable and kind... has been my phys for several yrs. The person who stated he doesn't treat staff well was quite incompetent herself in the billing dept and continued to make gross errors. I wish he would hire an RN rather ill prepared MAs . Used to be my favorite doctor and was so sad to leave when insurance changed. However got excited when I could return when received new insurance. However it seems his disposition has changed doesn’t seem as caring or concerned when before he would’ve been. I am thinking it’s because I my hadn’t been more than a year since we change so we were grandfathered in with the current insurance. It almost feels as if were treated more poorly because of our insurance. Things that should be tested like my potassium which is always low, isn’t. Iron levels, isn’t. I am scared to ask questions anymore because he makes you feel dumb. This doctor I highly respected with my health before now I feel I’m being fluffed off and I rarely go unless u absolutely need to. Because of this experience I’m afraid to go to any doctor now. I left this office the last time and literally cried the whole way home because I felt Like I was being treated like a woman I was just worthless! As if I didn’t know my own body. I left there were no diagnosis end up in the clinic the following day to find out I have strep throat, A kidney infection and other stuff. No testing was done when I went even with my complaints. I used to be very impressed and thought he cared about my health and well being. He has changed in the last couple years and I have caught his staff in more than one fib. He quit taking my medicaid and let me know thru a letter after I got home from an appointment the same day. No notice, just wham and I'm out! He actually took my insurance several years ago when I lost a job and was going thru a tough time. I don't know what happened but he really changed in his attitude towards me. I used to put him on a pedestal because I thought he cared so much for my health and well being. I don't know what happened. I actually am extremely saddened that he chose to not accept my insurance any longer and I have to leave his practice. Dr Hak is an awesome Internist who is knowledgeable and kind... has been my phys for several yrs. The person who stated he doesn't treat staff well was quite incompetent herself in the billing dept and continued to make gross errors. I wish he would hire an RN rather ill prepared MAs .","After having multiple physicians while moving around the USA ... I feel fortunate to have found Dr Hak. He is thorough and compassionate. I have complete faith that he provides me with the best care possible. High compitancy and concern. I am a 73 year old male and have had my share of doctors . Dr. Hak would be my #1 choice of them all. He is proactive, but has a common sense approach dealing with problems. My wife has

been in the hospital several times under a specialist care, but Dr. Hak always stopped to see how she was doing, just an example of how he goes out of his way for you. His staff have always been helpful to us when we needed it. I think that Dr. Hak is a very good doctor and a good person also. Great doctor, always takes as much time as you need and is very caring He is very caring and listens to what you have to say!He is politeand reliable! Have been doctoring with Dr. Hak for approx. 5 - 6 years. He is one of the best - spends time, and explains everything in detail. Went out of his way to visit me in the hospital when operated on by another doctor and didn't charge for the visit. The best. Spends time asking questions, and explaining things. Cares about his patients. Dr. Hak is a wonderful doctor. I was so ill I couldn't get out of bed and he now has me walking and my legs are stronger than they have been in a long time. He is always pleasant mannered. After having multiple physicians while moving around the USA ... I feel fortunate to have found Dr Hak. He is thorough and compassionate. I have complete faith that he provides me with the best care possible. High compitancy and concern. I am a 73 year old male and have had my share of doctors . Dr. Hak would be my #1 choice of them all. He is proactive, but has a common sense approach dealing with problems. My wife has

been in the hospital several times under a specialist care, but Dr. Hak always stopped to see how she was doing, just an example of how he goes out of his way for you. His staff have always been helpful to us when we needed it. I think that Dr. Hak is a very good doctor and a good person also. Great doctor, always takes as much time as you need and is very caring He is very caring and listens to what you have to say!He is politeand reliable! Have been doctoring with Dr. Hak for approx. 5 - 6 years. He is one of the best - spends time, and explains everything in detail. Went out of his way to visit me in the hospital when operated on by another doctor and didn't charge for the visit. The best. Spends time asking questions, and explaining things. Cares about his patients. Dr. Hak is a wonderful doctor. I was so ill I couldn't get out of bed and he now has me walking and my legs are stronger than they have been in a long time. He is always pleasant mannered.",6,14,Internist / Geriatrician, Male,10
